{
  "schemaVersion": "1.0.0",
  "reviewId": "SEC-0205",
  "generatedAt": "2026-09-05T17:05:00.000Z",
  "scope": {
    "kind": "repository",
    "included": [
      "Current private internal package candidate and release verification path",
      "Local security, Gitleaks, CodeQL, checksum, SBOM, and provenance controls",
      "Hosted GitHub branch, Actions, vulnerability-reporting, secret, dependency, and code-scanning controls",
      "Trusted signature and independent-review enforcement"
    ],
    "excluded": [
      "Credential validation and secret values",
      "Remote-only refs and unreachable or pruned Git objects",
      "Hosted mutation, signing, publication, deployment, and Azure operations"
    ],
    "trustBoundaries": [
      "Dirty local working tree to unsigned release candidate",
      "Local source and evidence to GitHub-hosted workflows",
      "GitHub branch and repository settings to protected source history",
      "Checksummed candidate to trusted signing and independent-review identities",
      "Internal package distribution to downstream project workspaces"
    ]
  },
  "findings": [
    {
      "id": "SECF-0205",
      "title": "Independent human review is not enforced for source changes",
      "path": "github.com/QuyDu/Skills-Orchestrator",
      "line": null,
      "category": "supply-chain",
      "classification": "proven-weakness",
      "severity": "medium",
      "confidence": "high",
      "impact": "A compromised or mistaken sole maintainer can submit code that passes automated checks without a second person reviewing design intent, trust boundaries, or release consequences.",
      "exploitPath": "The sole write-capable administrator submits a change that satisfies automated checks but contains a human-reviewable logic or governance defect; no approving reviewer is required before merge.",
      "evidence": ["Main requires strict Aggregate cross-platform evidence and JavaScript security analysis checks with admin enforcement.", "Force pushes and deletions are disabled; linear history and conversation resolution are required.", "Secret scanning, push protection, Dependabot security updates, vulnerability alerts, automated fixes, and private vulnerability reporting are enabled.", "Actions are restricted to GitHub-owned actions, CodeQL has zero open alerts, but required pull-request reviews are unset because only one write-capable collaborator exists."],
      "resolution": "Provision a distinct qualified collaborator or team, require at least one approving review, and assign CODEOWNERS to security-sensitive source; retain separately signed independent release review.",
      "requiresRotation": false,
      "references": ["SECURITY.md Release Gates", "GitHub REST read-only repository evidence collected 2026-09-05"]
    }
  ],
  "limitations": [
    "Merge commit 5190959 is present on GitHub and its Security Validation and CodeQL runs pass.",
    "No credential was validated and no candidate value is recorded.",
    "Hosted safeguards were changed under explicit approval; no collaborator, release, tag, signing identity, or publication was created.",
    "A signed independent review must come from a distinct trusted reviewer; this assessment does not satisfy that release gate."
  ]
}